"Два еврея ползут на вершину пика Коммунизма, кто её достигнет — станет русским. Абрам первым вползает на пик:<br/> — Ну вот, свершилось!<br/> Мойша из последних сил просительно протягивает руку:<br/> — Абрам, помоги…<br/> — Пошел вон, жидовская морда. И пихает Мойшу ногой…"
"Из всех машин Штирлиц предпочитал “Мерседесы”, проявляя тем самым истинно немецкий патриотизм, столь полезный для конспирации.<br/> — При этом русский разведчик очень радовался, что он — не немецкий шпион в России. А то пришлось бы ездить на “Запорожце”."
"— Мама, мама! Вовка меня всю обрызгал!<br/> — А ты его тоже обрызгай.<br/> — Но, мама, как? Я же девочка!"
"В зоопарке девочка спрашивает у матери:<br/> — Мамочка, а почему этот козёл так грустно глядит куда—то в даль?<br/> — А ты своего папу часто весёлым видишь? Жизнь у них такая."
"Маленький дворик, во дворике детская площадка. Из песочницы выкинут весь песок, кругом ведерки—совочки, формочки по ломаные. Грибок загнут под прямым углом, качели в узел завязаны… Сидит в пустой песочнице девочка, грязная вся, колготки порваны, бантик на ухо съехал. И говорит:<br/> — Уфф, нагулялася!"
"Марьванна на уроке математике:<br/> — Дети, слушайте задачу: в корзинке лежат 5 яблок. Вопрос:  — Каким образом необходимо разделить яблоки в корзине между пятью девочками, чтобы каждой девочке досталось по одному яблоку. И при этом еще одно осталось в корзине.<br/> Вовочка:<br/> — Надо корзинкой убить одну девочку!"
"Встречаются два одессита:<br/> — Вы знаете, наша Циля — архитектор…<br/> — Да, и шо она строит?<br/> — А, эта дура ходит по Дерибасовской и строит из себя девочку."
"Мaленькaя девочка делает уроки, тaм вопрос:<br/> — Что отделяет голову от телa?<br/> Онa усмехаясь:<br/> — Проще простого — топор."
"Две девочки 5 лет в детском саду. Одна хвастается другой:<br/> — А у нас новый папа!<br/> — А как его зовут?<br/> — Сергей Степаныч.<br/> — Петров?<br/> — Да—а…<br/> — А, этот — хороший! Он был у нас папой в прошлом году!"
"Чикаго, идет перестрелка мафии. В беременную женщину попадает несколько пуль. Она выживает. Дети рождаются Позже прибегает девочка к матери и плача говорит:<br/> — Мама я писала и выписала пулю.<br/> — Да вот был такой случай несколько лет назад…<br/> Позже прибегает мальчик:<br/> — Мама…<br/> — Знаю ты писал и выписал пулю.<br/> — Нет, я дрочил и застрелил бабушку."
"Папа 14—летней дочке:<br/> — Дочка, если ты будешь себя вести как хорошая девочка, то получишь от меня на Новый Год серебряный браслет.<br/> — Папа, за то, что я вела себя как плохая девочка, мне уже подарили золотой…"
"Рабинович пришел в публичный дом. Мадам вывела девочек, предложила выбирать.<br/> — Я выберу ту, что мне сделает любовь по—еврейски — говорит Рабинович.<br/> Все переглядываются…<br/> — Нет, мы умеем по—французки, по—обыкновенному, а по—еврейски— не умеем.<br/> — Ну, тогда я пошел.<br/> Вдруг одна девушка говорит:<br/> — Я умею по—еврейски.<br/> Зашли в номер и она признается:<br/> — Вы знаете, Рабинович, я Вам соврала. Я не умею делать любовь по—еврейски. Но сейчас такие тяжелые времена — клиентов мало, конкуренция… Я Вам сделаю обычную любовь за пол—цены.<br/> — Ой, моя птичка! Так это же и есть — любовь по—еврейски!"
"Приходит к доктору дряхлый старикашка:<br/> — Ну—с! На что жалуемся?<br/> — Видишь ли сынок мне 94 года, а я всё ещё бегаю за девочками!<br/> — Ну и прекрасно, в вашем то возрасте!<br/> — Только вот никак не вспомню — а зачем!?"
"Проверяющий генерал, выходя из бани:<br/> — А девочки были весьма не дурны!<br/> Полковник шепчет начштаба:<br/> — Наградить за боевые заслуги рядовых Иванова, Петрова и Васечкина!"
"В детском саду. Девочка сочинила стишок и декламирует:<br/> — А у нас в квартире кошка родила троих котят, подросли они немножко и все в партию хотят.<br/> Похвалила ее директриса:<br/> — Вот скоро придет комиссия, и ты выступишь.<br/> Приехала комиссия. Девочка выступает:<br/> — А у нас в квартире коша родила троих котят, подросли они немножко, двое в партию хотят.<br/> Директриса (шепотом):<br/> — Трое, а не двое! Девочка:<br/> — Так у одного уже глазки открылись!"
"Девочка приходит в магазин и спрашивает:<br/> — Скажите, у вас водка вчера свежая была?<br/> — Она у нас всегда свежая…<br/> — Хм… Странно… Я вот две бутылки выпила, и меня так рвало, так рвало…"
"Аннет с бабушкой пошли в лес за грибами. Девочка нашла гриб—подосиновик. Бабушка сказала:<br/> — Аннет, ищи рядом, эти грибы семьями растут!<br/> Девочка ответила:<br/> — А вдруг он холостой?"
"В доме — праздник. Пришли гости. У одной молодой пары была пятилетняя дочка. Мама ей говорит:<br> — Расскажи нам, Танечка, что—нибудь веселенькое!<br/> Девочка ушла в другую комнату. Через несколько минут вернулась и сообщила:<br/> — Я белеменна!<br/> Все гости шокированы, а девочка продолжает:<br/> — Вчела няня говорит папе:  — Я белеменна, а папа сказал: — Веселенькая история!</br>"
"Обидно, когда качался несколько лет, а когда пропал без вести, в приметах написали «обычного телосложения»."
Кошка с девятью жизнями почти перебежала десятиполосную МКАД.
"Не пойму, что мне нравится больше, собирать грибы, или же просто медленно ходить по осеннему лесу с ножом в руке."
"Мося приходит к Саре и говорит:<br/> — Сагочка, говорят ты обладаешь даром очаровывать мужчин. Это правда?<br/> — ДАРОМ???!!! Ни за что!!!"
"Абрам записался в парашютный кружок, настал день первого прыжка. Сара с Додиком пошли смотреть. Все спрыгнули, приземлились, все ходят, а Абрам лежит без чувств.<br/> — Додик, сходи посмотри, дышит ли папа?<br/> Додик возвращается:<br/> — Папа—то дышит, а вокруг дышать нечем."
"Четыре часа ночи. Изя ворочается с боку на бок в постели, никак не может уснуть. Сара его спрашивает:<br/> — Ты чего не спишь?<br/> — Да вот занял у Абрама червонец и давно истратил. Теперь придется свой отдавать, а жалко!<br/> Сара стучит в стенку:<br/> — Абрам, сосед, Изя брал у тебя червонец?<br/> — Да, брал.<br/> — Так вот, он тебе его не отдаст!<br/> Поворачивается к Изе:<br/> — Спи спокойно, теперь пусть Абрам мучается!"
"— Абрам, с твоей Сарой спит весь город, и что бы к ней попасть нужно занимать очередь, брось ее, зачем нужна тебе такая жена!<br/> — Ты понимаешь, если я ее брошу, то мне тоже нужно будет занимать очередь."
"— Сара, вы обладаете даром привлекать мужчин!<br/> — Даром? Даром я мужчин не привлекаю."
"Абрам:<br/> — Сара, ты меня любишь?<br/> Сара:<br/> — Да!<br/> Абрам:<br/> — Заплачешь, когда я умру?<br/> Сара:<br/> — Да!<br/> Абрам:<br/> — Покажи, как ты заплачешь.<br/> Сара:<br/> — А ты сначала умри!"
"Возле Светы всегда крутились кавказцы, поэтому у неё было прозвище Мангал."
"Отличие региональных новостей от общих: как страшно жить в мире, но как здорово жить в Калуге."
"Если рассматривать Камасутру и в перевернутом виде, количество поз удваивается."
"Обожаю читать гороскопы.<br/> Это единственное место, где у меня есть деньги, путешествия и идеальные отношения."
"Ван Гог отрезал себе ухо. Это неоспоримое свидетельство того, что радио «Шансон» существовало уже тогда."
"Пытаясь продать старую болгарку, Сергей сел на 14 лет за работорговлю."
"Пьяный ассенизатор споткнулся и упал в выгребную яму. Так сказать, целиком погрузился в работу…"
"Байкальская народная примета: если МЧС рапортует об уменьшении пожаров, значит там пошли дожди."
"Престарелая еврейская супружеская пара. Абрам говорит:<br/> — Сара, если кто—то из нас умрёт, я уеду в Израиль."
"Абрам:<br/> — Сарочка, к нам сегодня придёт Хаймович просить в долг. Убери туалетную бумагу от унитаза, и нарви газету — пусть увидит, как нам трудно живется."
"Моя бывшая очень много и часто рассказывала мне о своём бывшем, – так много, что в итоге он стал бывшим бывшим моей бывшей."
"Человек, который разбирается в арбузах, постучав в дверь, может понять – хорошие ли в квартире живут люди."
Даже после переезда из деревни в тюрьму – ничего не изменилось. Вася по прежнему просыпался с петухами.
"Если Россия завоюет весь мир, Кобзону негде будет лечиться."
"– Боюсь, я не смогу выиграть тендер вашей компании.<br> – А спорим на 15%, что сможешь?</br>"
"Зачем ворошить старое, если можно наворотить новое?"
"Помню, как-то я пьяный в муравейник упал…<br/> Кого другого закусали бы, а меня домой отнесли!"
"Во взгляде якобы признающей свою ошибку женщины не больше реального раскаяния, чем у нассавшего в туфли кота."
"Напрасно Запад боялся, что Путин восстанавливает СССР. На саммите ШОС выяснилось, что восстанавливает-то он империю Чингисхана."
"Когда российский спутник промахивается на 30 км от курса, я представляю, как будущие инженеры сидят сейчас на уроках православной культуры."
"«Я столько не съем!» – подумала самка богомола, когда два самца предложили ей секс втроём."
"Иду из магазина. Хомячу ряженку и булку на ходу… Все смотрят на меня, как на инопланетянина. А шёл бы, как обычно, с пивом и сигаретой, никто бы внимания не обратил."
"Узнав, что Путин раз в год проводит прямую линию, Кличко купил себе карандаш и линейку и теперь проводит по несколько прямых линий в день."
Новости правопорядка<br/> 1. Следователи упустили заказчика Немцова. Он покинул Россию.<br/> 2. Следственный комитет займется пчелками танцующими твёрк.
"Ничего не могу с собой поделать: как только слышу о том, что зарплата должна соответствовать результативности труда, в первую очередь вспоминаю правительство и национальную сборную по футболу. Да и вообще: складывается впечатление, что если поменять их местами, мало что в стране изменится."
Я женщина и поэтому говорю свое решительное «может быть».
Вот и лето заканчивается….. А я в этом году всего один раз купалась…. 19 января… В проруби…
"Гулливеру постоянно не везло с женщинами – он постоянно на них наступал, так сказать, ходил по бабам."
"Одна муха спрашивает у другой:<br/> – Простите, этот стул свободен?"
"Что ты вообще можешь знать о жизни, если ты в мороз на рынке штаны на картонке стоя не примерял?"
